[
  {
    "id": "stmt-t4-implies-t35",
    "kind": "implies",
    "from": ["t4"],
    "to": ["t3-5"],
    "context": "topological-spaces",
    "name": "T4 implies Tychonoff (T3 1/2)",
    "proofSketch": "Let X be normal and T1. Given a closed set C and a point x not in C, {x} is closed because X is T1. Since {x} and C are disjoint closed sets in a normal space, Urysohn's Lemma provides a continuous function f: X -> [0, 1] with f(x) = 0 and f(C) = {1}.",
    "keyLemma": "Urysohn's Lemma",
    "source": "Munkres, Topology (2nd ed.), §33 Theorem 33.1 (Urysohn Lemma); Willard §17",
    "verified": false,
    "leanName": "NormalSpace.completelyRegularSpace"
  },
  {
    "id": "stmt-t4-implies-normal",
    "kind": "implies",
    "from": ["t4"],
    "to": ["normal"],
    "context": "topological-spaces",
    "name": "T4 implies Normal",
    "proofSketch": "By definition, a T4 space is a topological space that is both normal and T1.",
    "keyLemma": "Definition of T4",
    "source": "Steen & Seebach, Counterexamples in Topology; Willard §14",
    "verified": false
  },
  {
    "id": "stmt-t35-implies-t3",
    "kind": "implies",
    "from": ["t3-5"],
    "to": ["t3"],
    "context": "topological-spaces",
    "name": "Tychonoff implies T3",
    "proofSketch": "If f: X -> [0, 1] separates x and closed set C with f(x) = 0 and f(C) = {1}, the preimages [0, 1/3) and (2/3, 1] under f are disjoint open sets containing x and C respectively. Since X is T1, X is T3.",
    "keyLemma": "Continuity of Urysohn function",
    "source": "Munkres, Topology (2nd ed.), §33; Willard §17",
    "verified": false
  },
  {
    "id": "stmt-t3-implies-regular",
    "kind": "implies",
    "from": ["t3"],
    "to": ["regular"],
    "context": "topological-spaces",
    "name": "T3 implies Regular",
    "proofSketch": "By definition, T3 is a regular space that also satisfies the T1 separation axiom.",
    "keyLemma": "Definition of T3",
    "source": "Steen & Seebach, Counterexamples in Topology; Munkres §31",
    "verified": false
  },
  {
    "id": "stmt-t3-implies-t2",
    "kind": "implies",
    "from": ["t3"],
    "to": ["t2"],
    "context": "topological-spaces",
    "name": "T3 implies Hausdorff (T2)",
    "proofSketch": "Given distinct points x, y in X, the singleton {y} is closed because X is T1. Since X is regular, the point x and closed set {y} can be separated by disjoint open sets, satisfying T2.",
    "keyLemma": "Singletons are closed in T1 spaces",
    "source": "Munkres, Topology (2nd ed.), §31 Theorem 31.1; Willard §14",
    "verified": false,
    "leanName": "T3Space.t2"
  },
  {
    "id": "stmt-t2-implies-t1",
    "kind": "implies",
    "from": ["t2"],
    "to": ["t1"],
    "context": "topological-spaces",
    "name": "Hausdorff implies T1",
    "proofSketch": "For any x != y, Hausdorff gives disjoint open sets U around x and V around y. Thus U contains x but not y, and V contains y but not x, which is the definition of T1.",
    "keyLemma": "Disjoint open sets around distinct points",
    "source": "Munkres, Topology (2nd ed.), §17; Willard §13",
    "verified": false,
    "leanName": "T2Space.t1"
  },
  {
    "id": "stmt-t1-implies-t0",
    "kind": "implies",
    "from": ["t1"],
    "to": ["t0"],
    "context": "topological-spaces",
    "name": "T1 implies T0",
    "proofSketch": "T1 provides open neighborhoods distinguishing x from y and y from x. Either neighborhood alone satisfies the T0 condition.",
    "keyLemma": "Definition of T0 and T1",
    "source": "Munkres, Topology (2nd ed.), §17; Willard §13",
    "verified": false,
    "leanName": "T1Space.t0"
  },
  {
    "id": "stmt-normal-and-t1-implies-t4",
    "kind": "implies",
    "from": ["normal", "t1"],
    "to": ["t4"],
    "context": "topological-spaces",
    "name": "Normal + T1 implies T4",
    "proofSketch": "A space that satisfies the normal separation axiom and T1 is by definition T4.",
    "keyLemma": "Definition of T4",
    "source": "Munkres, Topology (2nd ed.), §31; Willard §14",
    "verified": false
  },
  {
    "id": "stmt-regular-and-t1-implies-t3",
    "kind": "implies",
    "from": ["regular", "t1"],
    "to": ["t3"],
    "context": "topological-spaces",
    "name": "Regular + T1 implies T3",
    "proofSketch": "A regular space that is T1 is by definition T3.",
    "keyLemma": "Definition of T3",
    "source": "Munkres, Topology (2nd ed.), §31; Willard §14",
    "verified": false
  },
  {
    "id": "stmt-compact-implies-countably-compact",
    "kind": "implies",
    "from": ["compact"],
    "to": ["countably-compact"],
    "context": "topological-spaces",
    "name": "Compact implies Countably Compact",
    "proofSketch": "Any countable open cover is in particular an open cover. If every open cover has a finite subcover, every countable open cover also has a finite subcover.",
    "keyLemma": "Restriction to countable subcovers",
    "source": "Munkres, Topology (2nd ed.), §28; Willard §17",
    "verified": false
  },
  {
    "id": "stmt-seq-compact-implies-countably-compact",
    "kind": "implies",
    "from": ["sequentially-compact"],
    "to": ["countably-compact"],
    "context": "topological-spaces",
    "name": "Sequentially Compact implies Countably Compact",
    "proofSketch": "If X has an infinite sequence without an accumulation point, that sequence has no convergent subsequence, contradicting sequential compactness.",
    "keyLemma": "Accumulation points of sequences",
    "source": "Munkres, Topology (2nd ed.), §28 Theorem 28.2; Steen & Seebach",
    "verified": false
  },
  {
    "id": "stmt-second-countable-implies-first-countable",
    "kind": "implies",
    "from": ["second-countable"],
    "to": ["first-countable"],
    "context": "topological-spaces",
    "name": "Second Countable implies First Countable",
    "proofSketch": "If B is a countable base for the topology of X, then for each x in X the subfamily {B_i in B : x in B_i} is a countable local base at x.",
    "keyLemma": "Subcollection of base containing x",
    "source": "Munkres, Topology (2nd ed.), §30 Theorem 30.2; Willard §16",
    "verified": false
  },
  {
    "id": "stmt-second-countable-implies-lindelof",
    "kind": "implies",
    "from": ["second-countable"],
    "to": ["lindelof"],
    "context": "topological-spaces",
    "name": "Second Countable implies Lindelöf",
    "proofSketch": "Given any open cover U of X and a countable base B, for each element in U we can express it as a union of elements from B. Selecting one element of U for each used base element produces a countable subcover.",
    "keyLemma": "Countable basis representation",
    "source": "Munkres, Topology (2nd ed.), §30 Theorem 30.3; Willard §16",
    "verified": false
  },
  {
    "id": "stmt-countably-compact-and-lindelof-implies-compact",
    "kind": "implies",
    "from": ["countably-compact", "lindelof"],
    "to": ["compact"],
    "context": "topological-spaces",
    "name": "Countably Compact + Lindelöf implies Compact",
    "proofSketch": "Given an arbitrary open cover, Lindelöf reduces it to a countable subcover. Countable compactness then extracts a finite subcover from that countable subcover.",
    "keyLemma": "Two-step reduction of open covers",
    "source": "Munkres, Topology (2nd ed.), §30; Willard §17",
    "verified": false
  },
  {
    "id": "stmt-countably-compact-and-first-countable-implies-seq-compact",
    "kind": "implies",
    "from": ["countably-compact", "first-countable"],
    "to": ["sequentially-compact"],
    "context": "topological-spaces",
    "name": "Countably Compact + First Countable implies Sequentially Compact",
    "proofSketch": "In a countably compact space, every sequence has a cluster point x. If the space is first countable, a nested countable neighborhood basis at x allows constructing a subsequence converging to x.",
    "keyLemma": "Nested countable local basis construction",
    "source": "Munkres, Topology (2nd ed.), §28; Steen & Seebach",
    "verified": false
  },
  {
    "id": "stmt-metrizable-implies-t4",
    "kind": "implies",
    "from": ["metrizable"],
    "to": ["t4"],
    "context": "topological-spaces",
    "name": "Metrizable implies T4",
    "proofSketch": "Metric spaces are Hausdorff, hence T1. Disjoint closed sets A, B have positive separation d(x, B) and d(y, A), yielding disjoint open neighborhoods U = {x: d(x, A) < d(x, B)} and V = {y: d(y, B) < d(y, A)}.",
    "keyLemma": "Continuous distance function separation",
    "source": "Munkres, Topology (2nd ed.), §32 Theorem 32.1; Willard §14",
    "verified": false
  },
  {
    "id": "stmt-metrizable-implies-first-countable",
    "kind": "implies",
    "from": ["metrizable"],
    "to": ["first-countable"],
    "context": "topological-spaces",
    "name": "Metrizable implies First Countable",
    "proofSketch": "At any point x in a metric space, the open balls B(x, 1/n) for n = 1, 2, ... form a countable local neighborhood base.",
    "keyLemma": "Metric balls with rational radii",
    "source": "Munkres, Topology (2nd ed.), §30; Willard §16",
    "verified": false
  },
  {
    "id": "stmt-t1-countably-compact-equiv-limit-point-compact",
    "kind": "equivalent",
    "from": ["countably-compact"],
    "to": ["limit-point-compact"],
    "context": "t1-spaces",
    "name": "Countably Compact is Equivalent to Limit Point Compact in T1 Spaces",
    "proofSketch": "In any space, countably compact implies limit point compact. In a T1 space, if an infinite set has a limit point, every neighborhood of that point contains infinitely many points of the set, which allows extracting accumulation points for countable covers.",
    "keyLemma": "In T1 spaces, limit points of infinite sets have infinite intersections with neighborhoods",
    "source": "Munkres, Topology (2nd ed.), §28 Theorem 28.1; Steen & Seebach",
    "verified": false
  },
  {
    "id": "stmt-compact-implies-normal-hausdorff",
    "kind": "implies",
    "from": ["compact"],
    "to": ["normal"],
    "context": "hausdorff-spaces",